{
  "schema_version": 1,
  "base_commit": "33e34a1c367d061b64f309171a09ec6db3758bfd",
  "sources": [
    {
      "path": ".agent/capabilities.json",
      "subsystem": ".agent/capabilities.json",
      "sha256": "46fd7044137e5f78d9f6b70b94a520952bd2c3b5ed419fca4d297eb6b42684f5"
    },
    {
      "path": ".agent/context/architecture.md",
      "subsystem": ".agent/context",
      "sha256": "e49106ff2bd6f5cbe381f78203766a0f92e3fef6d1cc0ed7e21f398c6483e40b"
    },
    {
      "path": ".agent/context/conventions.md",
      "subsystem": ".agent/context",
      "sha256": "99fa3f1b58266fa0a66075737de6ad4a04d973a3a066ddaf04c125149f725941"
    },
    {
      "path": ".agent/context/dependencies.md",
      "subsystem": ".agent/context",
      "sha256": "088276822cc7090a268d1d4a1eabe2cfb6c8cad2ce38090ff7843b7aba9806b0"
    },
    {
      "path": ".agent/context/glossary.md",
      "subsystem": ".agent/context",
      "sha256": "203521d2c9745103f754e6a0d5148b2bc510400d0139c342b206605e8db449a0"
    },
    {
      "path": ".agent/context/navigation.md",
      "subsystem": ".agent/context",
      "sha256": "132fb408a3976ca281692702752b5288b56824c9ceeda6ba53e2455648466c80"
    },
    {
      "path": ".agent/context/project.md",
      "subsystem": ".agent/context",
      "sha256": "5035446f4de472960aacb7046d011978a76e4cfed71b892408231305216d7751"
    },
    {
      "path": ".agent/context/security.md",
      "subsystem": ".agent/context",
      "sha256": "8df9c07af30d8b055293beab5def5d992d191c42ada7e39305fa067503fdc87d"
    },
    {
      "path": ".agent/evals/routing.json",
      "subsystem": ".agent/evals",
      "sha256": "3ec5a923fb1d8b4c9679fff74bebbdca24d04db413cbb14b2184bcbb67d2a216"
    },
    {
      "path": ".agent/plugins/repository-search/.codex-plugin/plugin.json",
      "subsystem": ".agent/plugins",
      "sha256": "afe3a6e140fb6b7829d69628438ae9bf3d8aa6d3a07aa381f4149687ce129627"
    },
    {
      "path": ".agent/plugins/repository-search/scripts/search.mjs",
      "subsystem": ".agent/plugins",
      "sha256": "7c0ee8062262752f965e009c1ca743d1d09c3952a4642c5c248d807bd051cc75"
    },
    {
      "path": ".agent/plugins/repository-search/skills/search-docs/SKILL.md",
      "subsystem": ".agent/plugins",
      "sha256": "1211f74e6668a41264d009304ea6b3305a713a648c9cd56cd7521008ffe4b45a"
    },
    {
      "path": ".agent/schemas/handoff.schema.json",
      "subsystem": ".agent/schemas",
      "sha256": "f926227f98fd6e0d1c1d5dfb894413c15ec2646b3c0918dcbcc761c929686d5f"
    },
    {
      "path": ".agent/schemas/provenance.schema.json",
      "subsystem": ".agent/schemas",
      "sha256": "5505c55aea94e37b9f93827c526ffef97790c6a9d8c588ba203b0323a0ac6b9c"
    },
    {
      "path": ".agent/schemas/repo-index.schema.json",
      "subsystem": ".agent/schemas",
      "sha256": "5a2de0965f6ac323ea91a3498c4ce88d2df6822ff7240aa88c08cb550bd5d42b"
    },
    {
      "path": ".agent/schemas/task-state.schema.json",
      "subsystem": ".agent/schemas",
      "sha256": "204cb801258717bc6aa860d51bb6e706407edb40d61ee60ccebbda335c2a3ec7"
    },
    {
      "path": ".agent/scripts/architecture-check.mjs",
      "subsystem": ".agent/scripts",
      "sha256": "59d67e371c3bc34b0de4333c524c8b9545f65c202edbe4825011e2269c438ef2"
    },
    {
      "path": ".agent/scripts/capabilities.mjs",
      "subsystem": ".agent/scripts",
      "sha256": "a92b49efa4cb794c64ebe47596b891c66542bce4f314d6b064c1df8654b4bbaf"
    },
    {
      "path": ".agent/scripts/changed-files.mjs",
      "subsystem": ".agent/scripts",
      "sha256": "8d4e10240fe1c00cd88bd3f764b9e085e7b31daf55b77893f32a55379252d7f1"
    },
    {
      "path": ".agent/scripts/context-check.mjs",
      "subsystem": ".agent/scripts",
      "sha256": "41dbbb1df13c824dd753276b9f0d43fd52c6599f905e3032d5c762e6072f584d"
    },
    {
      "path": ".agent/scripts/context-health.mjs",
      "subsystem": ".agent/scripts",
      "sha256": "d0de92635996d418bdc17b5980505809a1b5b93d6758682a6c4e96abc5507f51"
    },
    {
      "path": ".agent/scripts/contracts.mjs",
      "subsystem": ".agent/scripts",
      "sha256": "2c8f38dc14e94b3ff797a706802907013f9f505854fc2dd047489f5f981a89c5"
    },
    {
      "path": ".agent/scripts/coordination.mjs",
      "subsystem": ".agent/scripts",
      "sha256": "764d76c2ec8faabf84dd98ca8e0f96346245de85236acd98153a2a90be564d05"
    },
    {
      "path": ".agent/scripts/evaluate.mjs",
      "subsystem": ".agent/scripts",
      "sha256": "d4acc6dd078e7b012b763df081743e3f93fe7b0ad747fc1726a9a9266f43b20f"
    },
    {
      "path": ".agent/scripts/impact-analysis.mjs",
      "subsystem": ".agent/scripts",
      "sha256": "bb95d363fb39901bd430fd68f940391fb0ad540bf8f22d70da2028041de4f2fc"
    },
    {
      "path": ".agent/scripts/lifecycle.mjs",
      "subsystem": ".agent/scripts",
      "sha256": "8fb3ebe988c5f558967b28ff82445523c1d91e279bbf87dd9285afdb23978aff"
    },
    {
      "path": ".agent/scripts/mcp-server.mjs",
      "subsystem": ".agent/scripts",
      "sha256": "af0eda028cebbee51f01adff1a47a9c8fbecebd45d7ab3f6db91a7e4049208bc"
    },
    {
      "path": ".agent/scripts/metrics.mjs",
      "subsystem": ".agent/scripts",
      "sha256": "22cedf84f512174c805db250353e152aad0e8c69a5d258c98fcc666dfd0e2405"
    },
    {
      "path": ".agent/scripts/route.mjs",
      "subsystem": ".agent/scripts",
      "sha256": "7da25579428cbccb26a6cfb3428f73bf4a9fb8cde2ffcac533df378d5e36edb5"
    },
    {
      "path": ".agent/scripts/search.mjs",
      "subsystem": ".agent/scripts",
      "sha256": "d2fb64a220440c31f69b87fca17727f47b780e892f3a830f57e4089fc699ad5a"
    },
    {
      "path": ".agent/scripts/subsystems.mjs",
      "subsystem": ".agent/scripts",
      "sha256": "7d5545221d8069e73876a05f57fda5e00e12abf7d66296b3cd0c50d41d68693f"
    },
    {
      "path": ".agent/scripts/symbols.mjs",
      "subsystem": ".agent/scripts",
      "sha256": "30ee27a6eacfe3f6b59ef9e1da86fedaffb9c3bba178b70cd3fbce0bacfaefc4"
    },
    {
      "path": ".agent/scripts/sync-skills.mjs",
      "subsystem": ".agent/scripts",
      "sha256": "299c188e06d1664e30daede1f9bfdd7804a92cbba072c8783b77e20d0277e559"
    },
    {
      "path": ".agent/scripts/update-index.mjs",
      "subsystem": ".agent/scripts",
      "sha256": "78cc0fb6cf2cc642fb42120a2acd2a6fe8979423f5329501477746723f3bdb48"
    },
    {
      "path": ".agent/scripts/verify.mjs",
      "subsystem": ".agent/scripts",
      "sha256": "49e1d6dfd5c1ea67f24c40583655526367d46536eb4e35ee6f304dd3454c4bfa"
    },
    {
      "path": ".agent/skills/architecture-analysis/SKILL.md",
      "subsystem": ".agent/skills",
      "sha256": "ea0f04edb4e94ccdb8a264d40989b22b5441fee3117cf58b3913c41c5df21ee5"
    },
    {
      "path": ".agent/skills/change-planning/SKILL.md",
      "subsystem": ".agent/skills",
      "sha256": "2e4395289eed43a25a6941af0a266d7cffb9e567283bb884462be8f8ff9793a5"
    },
    {
      "path": ".agent/skills/code-review/SKILL.md",
      "subsystem": ".agent/skills",
      "sha256": "4e53f6537b102d5c6ef892fce0618737a6366a471eb65a54fde68104e4d37e73"
    },
    {
      "path": ".agent/skills/implementation/SKILL.md",
      "subsystem": ".agent/skills",
      "sha256": "a2d773c94bce577fcdf0b0af51719f531dfe7f791c6721c4e1edcad2ec341f21"
    },
    {
      "path": ".agent/skills/release/SKILL.md",
      "subsystem": ".agent/skills",
      "sha256": "9f47a5b19a79fc9295845f2d55ef06ad457d93d0cf1e55cd6d2b2aa3677c453e"
    },
    {
      "path": ".agent/skills/repo-discovery/SKILL.md",
      "subsystem": ".agent/skills",
      "sha256": "18175ddb47ecd364d7bd15777f09f6b35d0caf98e3949366723178f62c845518"
    },
    {
      "path": ".agent/skills/security-review/SKILL.md",
      "subsystem": ".agent/skills",
      "sha256": "cb33484c4b0fe8892d24f7b66f270d8d86a76165b1b4a3b06751514c95d80ba1"
    },
    {
      "path": ".agent/skills/verification/SKILL.md",
      "subsystem": ".agent/skills",
      "sha256": "f3a436ef8b31a35b48e8bd1e641a50ae0a99429ca701b2674623db73eb71b435"
    },
    {
      "path": ".claude/README.md",
      "subsystem": ".claude/README.md",
      "sha256": "46d3abb2fed9e8142b02cf9ad37eb5892c62ddeea94020ec429a35ada4cdb375"
    },
    {
      "path": ".claude/settings.json",
      "subsystem": ".claude/settings.json",
      "sha256": "6db494b524e8cdf9acbb9b510b4ea13cfd61b556830cdbc74e282b8fdc6c0bd6"
    },
    {
      "path": ".claude/skills/architecture-analysis/SKILL.md",
      "subsystem": ".claude/skills",
      "sha256": "ea0f04edb4e94ccdb8a264d40989b22b5441fee3117cf58b3913c41c5df21ee5"
    },
    {
      "path": ".claude/skills/change-planning/SKILL.md",
      "subsystem": ".claude/skills",
      "sha256": "2e4395289eed43a25a6941af0a266d7cffb9e567283bb884462be8f8ff9793a5"
    },
    {
      "path": ".claude/skills/code-review/SKILL.md",
      "subsystem": ".claude/skills",
      "sha256": "4e53f6537b102d5c6ef892fce0618737a6366a471eb65a54fde68104e4d37e73"
    },
    {
      "path": ".claude/skills/implementation/SKILL.md",
      "subsystem": ".claude/skills",
      "sha256": "a2d773c94bce577fcdf0b0af51719f531dfe7f791c6721c4e1edcad2ec341f21"
    },
    {
      "path": ".claude/skills/release/SKILL.md",
      "subsystem": ".claude/skills",
      "sha256": "9f47a5b19a79fc9295845f2d55ef06ad457d93d0cf1e55cd6d2b2aa3677c453e"
    },
    {
      "path": ".claude/skills/repo-discovery/SKILL.md",
      "subsystem": ".claude/skills",
      "sha256": "18175ddb47ecd364d7bd15777f09f6b35d0caf98e3949366723178f62c845518"
    },
    {
      "path": ".claude/skills/security-review/SKILL.md",
      "subsystem": ".claude/skills",
      "sha256": "cb33484c4b0fe8892d24f7b66f270d8d86a76165b1b4a3b06751514c95d80ba1"
    },
    {
      "path": ".claude/skills/verification/SKILL.md",
      "subsystem": ".claude/skills",
      "sha256": "f3a436ef8b31a35b48e8bd1e641a50ae0a99429ca701b2674623db73eb71b435"
    },
    {
      "path": ".codex/README.md",
      "subsystem": ".codex/README.md",